{
  "schema_version": "1.0",
  "capture": {
    "id": "45261547",
    "tier": "lidar",
    "source_app": "ARKitScenes (iPad Pro LiDAR)",
    "device": null,
    "frames_used": 164,
    "notes": [
      "327 frames with poses"
    ]
  },
  "rooms": [],
  "adjacency": [],
  "property": {
    "room_count": 0,
    "footprint_area": {
      "value": 0.0,
      "unit": "m2",
      "ci_low": 0.0,
      "ci_high": 0.0,
      "ci_level": 0.9,
      "method": "lidar depth fusion, plane fit"
    },
    "extent_x": {
      "value": 0.0,
      "unit": "m",
      "ci_low": -0.016448536269514716,
      "ci_high": 0.016448536269514716,
      "ci_level": 0.9,
      "method": "lidar depth fusion, plane fit"
    },
    "extent_y": {
      "value": 0.0,
      "unit": "m",
      "ci_low": -0.016448536269514716,
      "ci_high": 0.016448536269514716,
      "ci_level": 0.9,
      "method": "lidar depth fusion, plane fit"
    }
  },
  "scope": [],
  "drift": {
    "method": "4-DoF pose graph with ICP loop closures, then plane-anchored bundle adjustment",
    "enabled": true,
    "residual_before_m": 0.0184,
    "residual_after_m": 0.0135,
    "notes": [
      "pose graph: 10 fragments of 3 s, 14 loop closures",
      "plane adjustment: no plane associations; skipped",
      "plane adjustment: no plane associations; skipped",
      "plane adjustment: no plane associations; skipped"
    ]
  },
  "calibration": {
    "ci_level": 0.9,
    "method": "split-conformal per tier and quantity",
    "table": "lidar-conformal-7captures"
  },
  "timing_s": {
    "ingest": 0.0,
    "drift": 3.7,
    "reconstruct": 1.95,
    "stitch": 7.53,
    "measure": 0.0,
    "openings": 0.0,
    "damage": 0.03,
    "assemble": 0.0,
    "total": 13.7
  }
}